{
  "schemaVersion": 1,
  "id": "new-head",
  "profile": "pixal-single-v1",
  "inputs": {
    "comfyExport": {
      "path": "inputs/comfy-export.glb",
      "sha256": "0000000000000000000000000000000000000000000000000000000000000000"
    },
    "shellInspection": {
      "path": "inputs/shell-inspection.json",
      "sha256": "0000000000000000000000000000000000000000000000000000000000000000"
    },
    "field": {
      "path": "inputs/generated-field.npz",
      "sha256": "0000000000000000000000000000000000000000000000000000000000000000"
    },
    "detail": {
      "path": "inputs/detail.png",
      "sha256": "0000000000000000000000000000000000000000000000000000000000000000"
    },
    "ownership4k": {
      "path": "inputs/ownership-4096.png",
      "sha256": "0000000000000000000000000000000000000000000000000000000000000000"
    },
    "ownership1k": {
      "path": "inputs/ownership-1024.png",
      "sha256": "0000000000000000000000000000000000000000000000000000000000000000"
    },
    "paletteSkin": {
      "path": "inputs/pal-skin.png",
      "sha256": "0000000000000000000000000000000000000000000000000000000000000000"
    },
    "paletteHair": {
      "path": "inputs/pal-hair.png",
      "sha256": "0000000000000000000000000000000000000000000000000000000000000000"
    },
    "inspectionColor": {
      "path": "inputs/basecolor-2048.png",
      "sha256": "0000000000000000000000000000000000000000000000000000000000000000"
    },
    "inspectionRoughness": {
      "path": "inputs/roughness-2048.png",
      "sha256": "0000000000000000000000000000000000000000000000000000000000000000"
    },
    "inspectionMetallic": {
      "path": "inputs/metallic-2048.png",
      "sha256": "0000000000000000000000000000000000000000000000000000000000000000"
    },
    "inspectionOpacity": {
      "path": "inputs/opacity-2048.png",
      "sha256": "0000000000000000000000000000000000000000000000000000000000000000"
    }
  },
  "mesh": {
    "triangleBudget": 20000,
    "alphaWrap": false,
    "maximumRelativeSurfaceError": 0.004,
    "allowDecoderOvershoot": false
  },
  "tone": {
    "skin": {
      "referenceBoxes": [
        [
          0.3,
          0.2,
          0.4,
          0.3
        ]
      ],
      "reviewed": false
    },
    "hair": {
      "referenceBoxes": [
        [
          0.3,
          0.2,
          0.4,
          0.3
        ]
      ],
      "reviewed": false
    }
  },
  "ownership": {
    "mode": "atlas",
    "sourceSha256": "0000000000000000000000000000000000000000000000000000000000000000",
    "reviewed": false
  },
  "palette": {
    "inputs": {
      "0": "paletteSkin",
      "1": "paletteHair"
    },
    "rows": {
      "0": 0,
      "1": 0
    },
    "shadeOffsets": {}
  },
  "fit": {
    "model": "reserved_slot",
    "maximumRelativeResidual": 0.02,
    "landmarks": [
      {
        "name": "left",
        "sourceNwnBasis": [
          0,
          0,
          0
        ],
        "targetNwnLocal": [
          0,
          0,
          0
        ]
      },
      {
        "name": "right",
        "sourceNwnBasis": [
          1,
          0,
          0
        ],
        "targetNwnLocal": [
          1,
          0,
          0
        ]
      },
      {
        "name": "nose",
        "sourceNwnBasis": [
          0.5,
          0.5,
          1
        ],
        "targetNwnLocal": [
          0.5,
          0.5,
          1
        ]
      },
      {
        "name": "chin",
        "sourceNwnBasis": [
          0.5,
          -1,
          0
        ],
        "targetNwnLocal": [
          0.5,
          -1,
          0
        ]
      }
    ]
  },
  "render": {
    "frontAngleDegrees": -90,
    "sizes": [
      2048,
      1024
    ],
    "mapInputs": {
      "basecolor": "inspectionColor",
      "roughness": "inspectionRoughness",
      "metallic": "inspectionMetallic",
      "opacity": "inspectionOpacity"
    }
  },
  "approval": {
    "appearanceField": {
      "decision": "pending",
      "geometryInput": "comfyExport",
      "geometrySha256": "0000000000000000000000000000000000000000000000000000000000000000",
      "fieldSha256": "0000000000000000000000000000000000000000000000000000000000000000",
      "notes": "Review the generated field against this exact active geometry input."
    },
    "textureMaps": {
      "inspectionColor": {
        "decision": "pending",
        "sourceSha256": "0000000000000000000000000000000000000000000000000000000000000000",
        "textureSha256": "0000000000000000000000000000000000000000000000000000000000000000",
        "notes": "Review this exact atlas on the active UV mesh."
      },
      "inspectionRoughness": {
        "decision": "pending",
        "sourceSha256": "0000000000000000000000000000000000000000000000000000000000000000",
        "textureSha256": "0000000000000000000000000000000000000000000000000000000000000000",
        "notes": "Review this exact atlas on the active UV mesh."
      },
      "inspectionMetallic": {
        "decision": "pending",
        "sourceSha256": "0000000000000000000000000000000000000000000000000000000000000000",
        "textureSha256": "0000000000000000000000000000000000000000000000000000000000000000",
        "notes": "Review this exact atlas on the active UV mesh."
      },
      "inspectionOpacity": {
        "decision": "pending",
        "sourceSha256": "0000000000000000000000000000000000000000000000000000000000000000",
        "textureSha256": "0000000000000000000000000000000000000000000000000000000000000000",
        "notes": "Review this exact atlas on the active UV mesh."
      }
    }
  }
}
