{
  "schemaVersion": 1,
  "id": "complex-head",
  "profile": "pixal-multiview-v1",
  "inputs": {
    "frontClay": {
      "path": "inputs/front-clay.png",
      "sha256": "0000000000000000000000000000000000000000000000000000000000000000"
    },
    "frontDetail": {
      "path": "inputs/front-detail.png",
      "sha256": "0000000000000000000000000000000000000000000000000000000000000000"
    },
    "leftClay": {
      "path": "inputs/left-clay.png",
      "sha256": "0000000000000000000000000000000000000000000000000000000000000000"
    },
    "leftDetail": {
      "path": "inputs/left-detail.png",
      "sha256": "0000000000000000000000000000000000000000000000000000000000000000"
    },
    "backClay": {
      "path": "inputs/back-clay.png",
      "sha256": "0000000000000000000000000000000000000000000000000000000000000000"
    },
    "backDetail": {
      "path": "inputs/back-detail.png",
      "sha256": "0000000000000000000000000000000000000000000000000000000000000000"
    },
    "rightClay": {
      "path": "inputs/right-clay.png",
      "sha256": "0000000000000000000000000000000000000000000000000000000000000000"
    },
    "rightDetail": {
      "path": "inputs/right-detail.png",
      "sha256": "0000000000000000000000000000000000000000000000000000000000000000"
    }
  },
  "features": [
    {
      "name": "hair",
      "placementReviewed": false,
      "notes": "Describe attachment, sweep, visible rear mass, taper and end."
    },
    {
      "name": "horns-tusks-cyberware",
      "placementReviewed": false,
      "notes": "Record count, anatomical side, root and direction; explicitly say absent if none."
    }
  ],
  "alignment": {
    "fovDegrees": 20,
    "rigReviewed": false,
    "views": {
      "front": {
        "azimuthDegrees": 0,
        "orientationReviewed": false,
        "crown": [
          0.5,
          0.1
        ],
        "chin": [
          0.5,
          0.9
        ],
        "skullCenter": [
          0.5,
          0.5
        ],
        "alignment": {
          "landmarks": [
            {
              "name": "crown",
              "clay": [
                0.5,
                0.1
              ],
              "detail": [
                0.5,
                0.1
              ]
            },
            {
              "name": "chin",
              "clay": [
                0.5,
                0.9
              ],
              "detail": [
                0.5,
                0.9
              ]
            },
            {
              "name": "temple",
              "clay": [
                0.3,
                0.4
              ],
              "detail": [
                0.3,
                0.4
              ]
            }
          ],
          "minimumSilhouetteIoU": 0.94,
          "maximumRelativeResidual": 0.01
        }
      },
      "left": {
        "azimuthDegrees": 90,
        "orientationReviewed": false,
        "crown": [
          0.5,
          0.1
        ],
        "chin": [
          0.5,
          0.9
        ],
        "skullCenter": [
          0.5,
          0.5
        ],
        "alignment": {
          "landmarks": [
            {
              "name": "crown",
              "clay": [
                0.5,
                0.1
              ],
              "detail": [
                0.5,
                0.1
              ]
            },
            {
              "name": "chin",
              "clay": [
                0.5,
                0.9
              ],
              "detail": [
                0.5,
                0.9
              ]
            },
            {
              "name": "temple",
              "clay": [
                0.3,
                0.4
              ],
              "detail": [
                0.3,
                0.4
              ]
            }
          ],
          "minimumSilhouetteIoU": 0.94,
          "maximumRelativeResidual": 0.01
        }
      },
      "back": {
        "azimuthDegrees": 180,
        "orientationReviewed": false,
        "crown": [
          0.5,
          0.1
        ],
        "chin": [
          0.5,
          0.9
        ],
        "skullCenter": [
          0.5,
          0.5
        ],
        "alignment": {
          "landmarks": [
            {
              "name": "crown",
              "clay": [
                0.5,
                0.1
              ],
              "detail": [
                0.5,
                0.1
              ]
            },
            {
              "name": "chin",
              "clay": [
                0.5,
                0.9
              ],
              "detail": [
                0.5,
                0.9
              ]
            },
            {
              "name": "temple",
              "clay": [
                0.3,
                0.4
              ],
              "detail": [
                0.3,
                0.4
              ]
            }
          ],
          "minimumSilhouetteIoU": 0.94,
          "maximumRelativeResidual": 0.01
        }
      },
      "right": {
        "azimuthDegrees": 270,
        "orientationReviewed": false,
        "crown": [
          0.5,
          0.1
        ],
        "chin": [
          0.5,
          0.9
        ],
        "skullCenter": [
          0.5,
          0.5
        ],
        "alignment": {
          "landmarks": [
            {
              "name": "crown",
              "clay": [
                0.5,
                0.1
              ],
              "detail": [
                0.5,
                0.1
              ]
            },
            {
              "name": "chin",
              "clay": [
                0.5,
                0.9
              ],
              "detail": [
                0.5,
                0.9
              ]
            },
            {
              "name": "temple",
              "clay": [
                0.3,
                0.4
              ],
              "detail": [
                0.3,
                0.4
              ]
            }
          ],
          "minimumSilhouetteIoU": 0.94,
          "maximumRelativeResidual": 0.01
        }
      }
    }
  },
  "camera": {
    "fovDegrees": 20,
    "reviewed": false,
    "notes": "Retained attempt51 fixed rig, not the single-image detector FOV."
  },
  "mesh": {
    "triangleBudget": 20000,
    "alphaWrap": false,
    "maximumRelativeSurfaceError": 0.004,
    "allowDecoderOvershoot": false
  },
  "approval": {
    "referenceDesignReviewed": false,
    "inputReviewComplete": false,
    "generatedGeometry": {
      "decision": "pending",
      "geometryRawSha256": "0000000000000000000000000000000000000000000000000000000000000000",
      "shapeSha256": "0000000000000000000000000000000000000000000000000000000000000000",
      "notes": "Review generated clay from all sides before approving these exact outputs."
    }
  }
}
